### ISSUE TITLE
VLANs over USB Ethernet (g_cdc/cdc_ether) - truncated IP packets

### ISSUE THREAD

**Issue by pakarw** [raspberrypi/linux#2661]
I have two Pi0's connected over USB for Ethernet networking, one of them set up in gadget mode with g_cdc. On both ends, I configured a single VLAN subinterface. The packets at MTU size sent over that subinterface are truncated by 4 bytes. This happens only in one direction: from g_cdc (gadget) to USB host (cdc_ether). The reverse traffic does not seem to be affected.

I got consistent results with kernels 4.9.59+, 4.14.50+ and 4.14.62+

```
# local (192.168.100.1) is in gadget mode, receiving large packets seems fine
pi@pi0:~$ scp pi@192.168.100.2:large_test_file .
large_test_file           17%   60MB   2.4MB/s   02:03 ETA

# from tcpdump on usb0.10, running on remote (192.168.100.2):
2018-08-25 13:39:10.669170 5e:3e:d1:c7:94:cd > 5e:d5:c7:bf:4d:a8, ethertype IPv4 (0x0800), length 1514: (tos 0x8, ttl 64, id 19105, offset 0, flags [DF], proto TCP (6), length 1500)
    192.168.100.2.22 > 192.168.100.1.56060: Flags [.], cksum 0x0e14 (correct), seq 4057188:4058636, ack 1261, win 543, options [nop,nop,TS val 265204 ecr 193432], length 1448
2018-08-25 13:39:10.671989 5e:3e:d1:c7:94:cd > 5e:d5:c7:bf:4d:a8, ethertype IPv4 (0x0800), length 1514: (tos 0x8, ttl 64, id 19106, offset 0, flags [DF], proto TCP (6), length 1500)
    192.168.100.2.22 > 192.168.100.1.56060: Flags [.], cksum 0xe022 (correct), seq 4058636:4060084, ack 1261, win 543, options [nop,nop,TS val 265205 ecr 193432], length 1448

# on sending, the connection got stalls
pi@pi0:~$ scp large_test_file pi@192.168.100.2:tmp/
large_test_file            3% 2112KB   0.0KB/s - stalled -

# from tcpdump on usb0.10, running on remote (192.168.100.2):
2018-08-25 13:40:33.761394 5e:d5:c7:bf:4d:a8 > 5e:3e:d1:c7:94:cd, ethertype IPv4 (0x0800), length 1510: truncated-ip - 4 bytes missing! (tos 0x8, ttl 64, id 49622, offset 0, flags [DF], proto TCP (6), length 1500)
    192.168.100.1.56062 > 192.168.100.2.22: Flags [.], seq 2059:3507, ack 2354, win 558, options [nop,nop,TS val 201744 ecr 273182], length 1448
2018-08-25 13:40:37.201441 5e:d5:c7:bf:4d:a8 > 5e:3e:d1:c7:94:cd, ethertype IPv4 (0x0800), length 1510: truncated-ip - 4 bytes missing! (tos 0x8, ttl 64, id 49623, offset 0, flags [DF], proto TCP (6), length 1500)
    192.168.100.1.56062 > 192.168.100.2.22: Flags [.], seq 2059:3507, ack 2354, win 558, options [nop,nop,TS val 202088 ecr 273182], length 1448
```

This is affecting IPv6 as well. With MTU on the gadget side reduced to 1496 everything works fine.

**Comment by pelwell** [comment]
The VLAN header takes up 4 bytes, so you can't expect a 1514 byte payload to make it through intact. What would you expect to happen with an invalid MTU size? (This is a genuine question, not snark)

**Comment by pakarw** [comment]
An interface should not accept MTU sizes greater than the size it can actually transmit:
```
pi@pi0:~$ sudo ifconfig usb0.10 mtu 1501
SIOCSIFMTU: Numerical result out of range
```
That on the source side. For over-sized _frames_, the destination can just drop it. Since the maximum frame size has been extended to 1522 bytes (1518+4 bytes VLAN tag) back in 1998, I would expect most of the current Ethernet implementations to handle that just fine. That still leaves 1500 bytes for Layer 3 use, whether L2 embeds the optional 1Q tag or not. Note that in my case the traffic flow in one direction is not affected.

Few years ago two patches have been submitted to to correct 1Q VLAN tagging in cdc_eem & g_ether:
```
From: Ian Coolidge <iancoolidge@xxxxxxxxx>
Date: Wed,  7 Nov 2012 16:39:17 -0800

> cdc_eem USB host driver and gadget driver both are broken in 1500 MTU
> case while using 802.1Q VLANs. In both cases, this is due to the
> assumption of standard Ethernet frame length.
> 
> v2: rebase against Dave Miller's 'net/master' tree
> 
> Ian Coolidge (2):
>   usb: gadget: g_ether: fix frame size check for 802.1Q
>   net: usb: cdc_eem: Fix rx skb allocation for 802.1Q VLANs
```

I guess cdc_ether may be still assuming 1514 (ETH_FRAME_LEN) size.

**Comment by 6by9** [comment]
Things have moved around a bit since 2012 and 23834e533184bd2185bce500c789f86b3668739b, but it looks like g_ether should support an MTU up to ~15kB now. https://github.com/raspberrypi/linux/blob/rpi-4.14.y/drivers/usb/gadget/function/u_ether.c#L51

I would be a little concerned that there are a couple of uses of ETH_FRAME_LEN (not VLAN_ETH_FRAME_LEN) in drivers/usb/gadget/function to set up wMaxSegmentSize (f_ecm, f_ncm, and f_subset), but I haven't looked into the detail of those usages. (They do appear related to cdc_ether).

**Comment by JamesH65** [comment]
This issue will be closed within 30 days unless further interactions are posted. If you wish this issue to remain open, please add a comment. A closed issue may be reopened if requested.

**Comment by JamesH65** [comment]
Closing due to lack of activity. Please request to be reopened if you feel this issue is still relevant.
