### ISSUE TITLE
Incorrect TCP checksum generated with HW offloading

### ISSUE THREAD

**Issue by Doridian** [raspberrypi/linux#2965]
**Describe the bug**
When connecting to some hosts, it seems the NIC incorrectly computes the checksum of the packet.

**To reproduce**
On my RPi3, if I run `curl 104.20.16.242:80` (this is ipv4.icanhazip.com from my DNS), it generates those packets

**Expected behaviour**
The correct checksum to be computed

**Actual behaviour**
An incorrect checksum is computed, resulting in a non-working TCP handshake.

**System**
 Copy and paste the results of the raspinfo command in to this section. Alternatively, copy and paste a pastebin link, or add answers to the following questions:

* Which model of Raspberry Pi?
Pi3B
* Which OS and version (`cat /etc/rpi-issue`)?
```
Raspberry Pi reference 2019-04-08
Generated using pi-gen, https://github.com/RPi-Distro/pi-gen, e910bf55ac92e27c6e77043e8995bcb5e0a2d742, stage2
```
* Which firmware version (`vcgencmd version`)?
```
Mar 27 2019 15:45:53
Copyright (c) 2012 Broadcom
version 2e98b31d18547962e564bdf88e57b3df7085c29b (clean) (release) (start)
```
* Which kernel version (`uname -a`)?
```
Linux ntp 4.19.40-v7+ #1217 SMP Tue May 7 17:22:08 BST 2019 armv7l GNU/Linux
```

**Logs**
This has been captured at the router, so all checksums *should* (and for all other machines are) correct
```
doridian@router# sudo tcpdump -i bond0 -f port 80 and host 192.168.1.27 -n -vvv -A
tcpdump: listening on bond0, link-type EN10MB (Ethernet), capture size 262144 bytes
06:25:43.450119 IP (tos 0x0, ttl 64, id 3278, offset 0, flags [DF], proto TCP (6), length 60)
    192.168.1.27.46990 > 104.20.16.242.80: Flags [S], cksum 0x66a0 (correct), seq 3703611330, win 29200, options [mss 1460,sackOK,TS val 1498261206 ecr 0,nop,wscale 7], length 0
E..<..@.@..$....h......P..........r.f..........
YM..........
06:25:43.451800 IP (tos 0x0, ttl 59, id 0, offset 0, flags [DF], proto TCP (6), length 52)
    104.20.16.242.80 > 192.168.1.27.46990: Flags [S.], cksum 0xdd90 (correct), seq 1259103524, ack 3703611331, win 29200, options [mss 1460,nop,nop,sackOK,nop,wscale 10], length 0
E..4..@.;...h........P..K.e$......r................

06:25:43.452126 IP (tos 0x0, ttl 64, id 3279, offset 0, flags [DF], proto TCP (6), length 40)
    192.168.1.27.46990 > 104.20.16.242.80: Flags [.], cksum 0x3ae4 (incorrect -> 0x8f91), seq 1, ack 1, win 229, length 0
E..(..@.@..7....h......P....K.e%P...:.........
```

**Additional context**
Problem is immediately "fixed" by `ethtool --offload  eth0  rx off  tx off`
